{
  "schema_version": "0.3",
  "snapshot_id": "44444444-aaaa-4444-8444-444444444444",
  "region": "document-01",
  "window_start": "2026-10-03T10:30:00+09:00",
  "window_end": "2026-10-03T10:35:00+09:00",
  "observations": {
    "trace_count": 30,
    "receipt_count": 6,
    "authority_request_count": 4,
    "authority_grant_count": 3,
    "authority_deny_count": 1,
    "active_agent_count": 5
  },
  "provenance": {
    "generated_at": "2026-10-03T10:35:02+09:00",
    "collector_id": "collector-document-01",
    "source_record_count": 40,
    "source_digest": "aaaaaaaaaaaaaaaaaaaaaaaaaaaaaaaaaaaaaaaaaaaaaaaaaaaaaaaaaaaaaaaa"
  }
}
