{
  "schema_version": "0.3",
  "snapshot_id": "44444444-4444-4444-8444-444444444444",
  "region": "document-processing",
  "window_start": "2026-10-03T10:20:00+09:00",
  "window_end": "2026-10-03T10:25:00+09:00",
  "observation_state": "partial",
  "observations": {
    "trace_count": 33,
    "receipt_count": 7,
    "authority_request_count": 4,
    "authority_grant_count": 3,
    "authority_deny_count": 1,
    "active_agent_count": 6
  },
  "provenance": {
    "generated_at": "2026-10-03T10:25:02+09:00",
    "collector_id": "collector-document-01",
    "source_record_count": 44,
    "source_digest": "aaaaaaaaaaaaaaaaaaaaaaaaaaaaaaaaaaaaaaaaaaaaaaaaaaaaaaaaaaaaaaaa"
  }
}
